,Product,Price,Original Price,Discount,Rating,Rating & reviews,Category,Sub category,brand
0,"Boult Boost Hybrid ANC & ENC Mic, 65H Battery, 40mm Boo...","₹3,999","₹9,999",60% off,4.1,(164),Electronics,Headphones,Boult
1,"Boult W40 with Quad Mic ENC, 48H Battery Life, Low Late...","₹1,299","₹2,999",56% off,4.1,"(1,05,398)",Electronics,Headphones,Boult
2,boAt Rockerz 255 Pro+ with ASAP Charge and upto 60 Hour...,"₹1,098","₹3,990",72% off,4.2,"(4,36,669)",Electronics,Headphones,boAt
3,boAt Airdopes 161/163 with ASAP Charge & 40 HRS Playbac...,₹899,"₹2,490",63% off,4,"(11,46,438)",Electronics,Headphones,boAt
4,boAt Airdopes 161/163 with ASAP Charge & 40 HRS Playbac...,₹899,"₹2,490",63% off,4,"(11,46,438)",Electronics,Headphones,boAt
5,"Boult W20 with Zen ENC Mic, 35H Battery Life, Low Laten...","₹1,099","₹2,499",56% off,4.1,"(1,24,506)",Electronics,Headphones,Boult
6,OPPO Enco Buds 2 with 28 hours Battery life & Deep Nois...,"₹1,599","₹3,999",60% off,4.3,"(3,84,039)",Electronics,Headphones,OPPO
7,GUGGU NH-219 SH12 Headset Super Extra Bass Bluetooth He...,₹579,"₹1,149",49% off,4.2,(9),Electronics,Headphones,GUGGU
8,"boAt Rockerz 110 with 40 HRS Playback, ENx Technology, ...","₹1,099","₹2,490",55% off,4.1,"(86,092)",Electronics,Headphones,boAt
9,"realme Buds T300 with 12.4mm Driver, 30dB ANC, 360 Spat...","₹1,799","₹3,999",55% off,4.3,"(83,185)",Electronics,Headphones,realme
10,"house of common Ultrapod Earbud, Bluetooth TWS with Dis...",₹479,"₹2,999",84% off,5,(10),Electronics,Headphones,house
11,"Boult W40 with Quad Mic ENC, 48H Battery Life, Low Late...","₹1,299","₹2,999",56% off,4.1,"(1,05,398)",Electronics,Headphones,Boult
12,boAt Rockerz 235 Pro with upto 20 Hours Playback & ASAP...,₹799,"₹2,490",67% off,4.1,"(4,09,363)",Electronics,Headphones,boAt
13,"TECHNUV S460 ANC High Quality Pure Sound, IPX5 Touch, M...",₹599,"₹2,499",76% off,4,(147),Electronics,Headphones,TECHNUV
14,"boAt Airdopes 161, Adv 4Mic ENx, 50H Battery,Fast Charg...",₹899,"₹2,990",69% off,3.9,"(11,161)",Electronics,Headphones,boAt
15,"boAt Airdopes Alpha with 35 HRS Playback, 13mm Drivers,...",₹799,"₹3,490",77% off,3.9,"(4,08,296)",Electronics,Headphones,boAt
16,"Noise Buds VS102 Elite with 50Hr Playtime, ENC, Quad Mi...","₹1,299","₹3,499",62% off,4,"(5,58,058)",Electronics,Headphones,Noise
17,"Boult Z60 with 60Hr Battery, Quad Mic ENC, 50ms Ultra L...",₹999,"₹2,999",66% off,4.1,"(36,690)",Electronics,Headphones,Boult
18,GUGGU FG-169 SH12 Headset Super Extra Bass Bluetooth He...,₹579,"₹1,149",49% off,2.5,(11),Electronics,Headphones,GUGGU
19,"boAt Rockerz 450 w/ 40mm Drivers, 15 HRS Playback, Soft...","₹1,499","₹3,990",62% off,4.3,"(3,67,337)",Electronics,Headphones,boAt
20,"Boult W40 with Quad Mic ENC, 48H Battery Life, Low Late...","₹1,299","₹2,999",56% off,4.1,"(1,05,398)",Electronics,Headphones,Boult
21,"Noise Buds VS102 Pro with ANC (25dB), 70 Hours Playtime...","₹1,599","₹4,999",68% off,3.8,"(54,447)",Electronics,Headphones,Noise
22,boAt 100 Wired,₹329,₹999,67% off,4.3,"(14,12,766)",Electronics,Headphones,boAt
23,OnePlus Bullets Wireless Z2 Bluetooth,"₹1,799","₹2,299",21% off,4.3,"(10,61,535)",Electronics,Headphones,OnePlus
24,"boAt Rockerz 110 with 40 HRS Playback, ENx Technology, ...","₹1,099","₹2,490",55% off,4.1,"(86,092)",Electronics,Headphones,boAt
25,"CMF by Nothing Buds 42 dB Active Noise Cancellation, Ul...","₹2,499","₹2,999",16% off,4.3,"(31,518)",Electronics,Headphones,CMF
26,"Boult Z40 Pro with 100H Battery, Quad Mic ENC, Scratch ...","₹1,299","₹5,499",76% off,4.1,"(95,464)",Electronics,Headphones,Boult
27,"boAt Rockerz 551 ANC with Hybrid ANC, 100 HRS Playback,...","₹3,499","₹7,990",56% off,3.9,"(4,018)",Electronics,Headphones,boAt
28,GUGGU GW-201 SH12 Headset Super Extra Bass Bluetooth He...,₹579,"₹1,149",49% off,3.2,(11),Electronics,Headphones,GUGGU
29,CMF by Nothing Neckband Pro 50dB Active Noise Cancellat...,"₹2,099","₹2,499",16% off,4.1,"(22,757)",Electronics,Headphones,CMF
30,"truke BTG1 Earbuds with Game Mode, 48H Playtime, Quad M...",₹799,"₹3,499",77% off,4,"(74,713)",Electronics,Headphones,truke
31,"truke BTG Ultra with 60H Playtime, 360Spatial, Low Late...",₹799,"₹2,999",73% off,4,"(9,827)",Electronics,Headphones,truke
32,"Boult Z40 Pro with 100H Battery, Quad Mic ENC, Scratch ...","₹1,199","₹5,499",78% off,4.1,"(95,464)",Electronics,Headphones,Boult
33,"boAt Airdopes Supreme w/ 4 Mics AI ENx Tech, 50 HRS Pla...","₹1,199","₹5,990",79% off,4.1,"(80,700)",Electronics,Headphones,boAt
34,Clairbell NF-199 SH12 Headset Super Extra Bass Bluetoot...,₹579,"₹1,149",49% off,3.8,(13),Electronics,Headphones,Clairbell
35,"Boult W20 with Zen ENC Mic, 35H Battery Life, Low Laten...",₹999,"₹2,499",60% off,4.1,"(1,24,506)",Electronics,Headphones,Boult
36,"Boult ProBass EQCharge with ZEN Mode ENC, 32hrs Playtim...",₹799,"₹4,499",82% off,3.9,"(1,32,496)",Electronics,Headphones,Boult
37,"Noise Buds VS102 Pro with ANC (25dB), 70 Hours Playtime...","₹1,599","₹3,999",60% off,3.8,"(54,447)",Electronics,Headphones,Noise
38,"Boult Z40 with Zen ENC Mic, 60H Battery Life, Low Laten...",₹999,"₹4,999",80% off,4.1,"(3,10,952)",Electronics,Headphones,Boult
39,boAt Airdopes 161/163 with ASAP Charge & 40 HRS Playbac...,₹899,"₹2,490",63% off,4,"(11,46,438)",Electronics,Headphones,boAt
40,"Noise Aura Buds with Dual Device Pairing, 60 Hours of P...","₹1,499","₹4,499",66% off,4,"(4,870)",Electronics,Headphones,Noise
41,"Noise Buds MVP102 with Dual Pairing, 60 Hours Playtime,...","₹1,399","₹2,999",53% off,3.9,"(1,931)",Electronics,Headphones,Noise
42,"boAt Airdopes 800 w/ Dolby Audio, 4 Mics AI-ENx Tech, T...","₹1,499","₹6,490",76% off,4.1,"(5,422)",Electronics,Headphones,boAt
43,"ZEBRONICS Zeb- Thunder, With 60H Backup, BT v5.3, Gamin...",₹799,"₹1,699",52% off,4,"(77,896)",Electronics,Headphones,ZEBRONICS
44,"boAt Immortal 161 w/ Beast Mode(40ms Low Latency), 40 H...",₹999,"₹3,499",71% off,4,"(11,46,438)",Electronics,Headphones,boAt
45,"realme Buds T110 (RMA2306) with AI ENC for calls, 38 ho...","₹1,499","₹2,999",50% off,4.1,"(74,350)",Electronics,Headphones,realme
46,"truke BTG Flex buds with Dual Pairing, 60Hrs Battery, H...",₹999,"₹3,499",71% off,4.2,"(1,318)",Electronics,Headphones,truke
47,"truke Buds Freedom OWS with QuadMic PureVoice ENC, 60H ...","₹1,499","₹6,999",78% off,3.9,"(1,224)",Electronics,Headphones,truke
48,Aroma B119C Carter 48 Hours Playing Time Fast Charging ...,₹299,"₹2,299",86% off,3.9,"(92,016)",Electronics,Headphones,Aroma
49,"realme Buds Wireless 3 Neo with 13.4mm Driver, 32 hrs P...","₹1,299","₹2,499",48% off,4.2,"(4,22,253)",Electronics,Headphones,realme
50,"Noise Buds X prime with 120 Hrs of Playtime, ENC with Q...","₹1,599","₹4,499",64% off,3.9,"(3,497)",Electronics,Headphones,Noise
51,"Noise Buds X prime with 120 Hrs of Playtime, ENC with Q...","₹1,599","₹4,499",64% off,3.9,"(3,497)",Electronics,Headphones,Noise
52,"boAt Airdopes 71 w/ 40 HRS Playback, ENx Technology & B...",₹899,"₹3,990",77% off,3.9,"(71,864)",Electronics,Headphones,boAt
53,Ucool Nexa 100 Hours Playtime Bluetooth Wireless Neckba...,₹501,"₹2,999",83% off,4,"(14,912)",Electronics,Headphones,Ucool
54,"truke BTG1 Earbuds with Game Mode, 48H Playtime, Quad M...",₹799,"₹3,499",77% off,4,"(74,713)",Electronics,Headphones,truke
55,"Boult Mustang Torq with 50 Hrs Battery, App Support, 4 ...","₹1,799","₹5,999",70% off,4.1,"(14,106)",Electronics,Headphones,Boult
56,"Noise Buds VS102 Pro with ANC (25dB), 70 Hours Playtime...","₹1,599","₹4,999",68% off,3.8,"(54,447)",Electronics,Headphones,Noise
57,"truke Clarity 6 with 80Hr Battery, 6Mic Adv.ENC, Dual C...","₹1,499","₹3,699",59% off,3.7,"(3,250)",Electronics,Headphones,truke
58,boAt Nirvana Ion with 120 Hours Playback & Crystal Bion...,"₹1,599","₹7,990",79% off,4.2,"(71,327)",Electronics,Headphones,boAt
59,"realme Buds T110 (RMA2306) with AI ENC for calls, 38 ho...","₹1,499","₹2,999",50% off,4.1,"(74,350)",Electronics,Headphones,realme
60,HOPPUP Predator Xo4 Gaming Earbuds with 35MS Low Latenc...,₹999,"₹4,999",80% off,4.1,"(4,501)",Electronics,Headphones,HOPPUP
61,"truke BTG Flex buds with Dual Pairing, 60Hrs Battery, H...","₹1,199","₹3,499",65% off,4.2,"(1,318)",Electronics,Headphones,truke
62,"Noise TWO with 50 Hours Playtime, Low latency (up to 40...","₹1,699","₹4,999",66% off,4,"(6,068)",Electronics,Headphones,Noise
63,boAt Airdopes 131 with upto 60 hours and ASAP Charge Bl...,₹799,"₹2,990",73% off,4,"(18,96,429)",Electronics,Headphones,boAt
64,Mi Basic Wired Headset with Mic,₹398,₹599,33% off,4.3,"(7,77,825)",Electronics,Headphones,Mi
65,"realme Buds Wireless 3 Neo with 13.4mm Driver, 32 hrs P...","₹1,299","₹2,499",48% off,4.2,"(4,22,253)",Electronics,Headphones,realme
66,"Noise Aura Buds with Dual Device Pairing, 60 Hours of P...","₹1,399","₹4,499",68% off,4,"(4,870)",Electronics,Headphones,Noise
67,"Boult Z40 Gaming with 60H Battery, App Support, Dual Pa...",₹999,"₹5,499",81% off,4.1,"(3,10,952)",Electronics,Headphones,Boult
68,"Boult Y1 with Zen ENC Mic, 50H Battery, Fast Charging, ...",₹999,"₹5,499",81% off,4,"(4,28,027)",Electronics,Headphones,Boult
69,JBL C50HI Wired,₹499,₹699,28% off,4,"(1,60,165)",Electronics,Headphones,JBL
70,"Boult Klarity 3 ANC 50dB Hybrid ANC, 6 Mics, App Suppor...","₹1,999","₹5,999",66% off,4.1,"(14,106)",Electronics,Headphones,Boult
71,"Noise Buds MVP102 with Dual Pairing, 60 Hours Playtime,...","₹1,399","₹2,999",53% off,3.9,"(1,931)",Electronics,Headphones,Noise
72,"Boult Y1 Pro with Zen Quad Mic ENC, 60Hrs Battery, Fast...","₹1,199","₹5,999",80% off,4.1,"(47,195)",Electronics,Headphones,Boult
73,"boAt Rockerz Trinity with 150 Hours Playback, Crystal B...","₹1,099","₹3,990",72% off,4,"(52,869)",Electronics,Headphones,boAt
74,"realme Buds Wireless 3 Neo with 13.4mm Driver, 32 hrs P...","₹1,299","₹2,499",48% off,4.2,"(4,22,253)",Electronics,Headphones,realme
75,"ZEBRONICS Zeb- Thunder, With 60H Backup, BT v5.3, Gamin...",₹729,"₹1,699",57% off,4,"(77,896)",Electronics,Headphones,ZEBRONICS
76,"truke BTG Storm Earbuds with 40ms Low Latency, 50H Play...",₹899,"₹2,499",64% off,4,"(15,736)",Electronics,Headphones,truke
77,"TRIGGR Apex S2 with Dual Pairing, 60H Battery, Quad Mic...",₹899,"₹3,999",77% off,3.9,"(2,901)",Electronics,Headphones,TRIGGR
78,"Noise Buds VS102 with 50 Hrs Playtime, 11mm Driver, IPX...",₹999,"₹2,999",66% off,4,"(5,58,058)",Electronics,Headphones,Noise
79,"Boult Y1 Pro with Zen Quad Mic ENC, 60Hrs Battery, Fast...","₹1,199","₹5,999",80% off,4.1,"(47,195)",Electronics,Headphones,Boult
80,Voods V Collar - Nova With 130Hrs Playback IP65- Water&...,"₹1,349","₹5,849",76% off,3.9,(12),Electronics,Headphones,Voods
81,PearlBeat Classic Bluetooth,₹999,"₹1,999",50% off,,,Electronics,Headphones,PearlBeat
82,OnePlus Nord Buds 3 with up to 32dB ANC Bluetooth,"₹2,299","₹2,799",17% off,4.3,"(2,756)",Electronics,Headphones,OnePlus
83,boAt Rockerz 255 Pro+ /258 Pro+ with ASAP Charge and up...,"₹1,099","₹3,990",72% off,4.2,"(6,45,565)",Electronics,Headphones,boAt
84,"Boult X45 with Quad Mic ENC, 40H Playtime, 45ms Ultra L...",₹799,"₹4,999",84% off,3.9,"(1,03,881)",Electronics,Headphones,Boult
85,"TECHFIRE Bullets 121 with Beast Mode(40ms Low Latency),...",₹549,"₹4,999",89% off,3.6,"(9,752)",Electronics,Headphones,TECHFIRE
86,"Voods V Collar - Active, 130 Hrs Playback, IP65 - Water...",₹749,"₹3,499",78% off,,,Electronics,Headphones,Voods
87,"Voods V Collar - Pro With 5 Different Voice Modes,IP65 ...","₹1,349","₹5,549",75% off,4,(10),Electronics,Headphones,Voods
88,boAt BassHeads 220 Wired,₹699,₹999,30% off,4.2,"(9,04,850)",Electronics,Headphones,boAt
89,OnePlus Nord Buds 2r in Ear Earbuds with Dual Mic & AI ...,"₹1,999","₹2,299",13% off,4.3,"(1,47,619)",Electronics,Headphones,OnePlus
90,PTron Bassbuds Viper Bluetooth,"₹1,099","₹3,499",68% off,3.8,"(2,613)",Electronics,Headphones,PTron
91,"truke Clarity 5 V2 6Mics Adv.ENC & Dual Connectivity, 8...",₹999,"₹3,499",71% off,4,"(73,092)",Electronics,Headphones,truke
92,"boAt Immortal 131 w/ Beast Mode(40ms Low Latency), 40 H...","₹1,199","₹3,499",65% off,4,"(1,21,357)",Electronics,Headphones,boAt
93,realme Buds Wireless 2 Neo with Type-C Fast Charge & Ba...,"₹1,299","₹2,499",48% off,4.2,"(4,22,253)",Electronics,Headphones,realme
94,"Boult W40 with Quad Mic ENC, 48H Battery Life, Low Late...","₹1,299","₹2,999",56% off,4.1,"(1,05,398)",Electronics,Headphones,Boult
95,OnePlus Bullets Wireless Z2 ANC Earphones with 45dB Hyb...,"₹2,299","₹2,499",8% off,4.2,"(79,796)",Electronics,Headphones,OnePlus
96,DIGITRENDS Crystal Bluetooth tws earbuds with 40 Hrs Ba...,₹699,"₹3,999",82% off,5,(4),Electronics,Headphones,DIGITRENDS
97,Flexnest Flexdubs True Wireless Earbuds Bluetooth,"₹1,299","₹9,999",87% off,3,(11),Electronics,Headphones,Flexnest
98,PROWARP PRODART Original EHS61 Deep Bass with Sound Can...,₹254,₹699,63% off,4,"(25,305)",Electronics,Headphones,PROWARP
99,"Boult W40 with Quad Mic ENC, 48H Battery Life, Low Late...","₹1,299","₹2,999",56% off,4.1,"(1,05,398)",Electronics,Headphones,Boult
100,"Voods V Collar - Active, 130 Hrs Playback, IP65 - Water...",₹749,"₹3,499",78% off,3.3,(4),Electronics,Headphones,Voods
101,Hammer Aero Max ENC + ANC earbuds TWS with Clear Callin...,"₹1,499","₹5,999",75% off,3.9,(89),Electronics,Headphones,Hammer
102,"Noise Buds VS102 Neo with 40 Hrs Playtime, Environmenta...",₹999,"₹3,499",71% off,4,"(76,397)",Electronics,Headphones,Noise
103,"Boult Rcharge with 30Hrs Playtime, ENC mic, Dual Device...",₹699,"₹1,799",61% off,4,"(15,385)",Electronics,Headphones,Boult
104,"Boult Astra with Quad Mic ENC, 48Hrs Battery, Low Laten...","₹1,299","₹3,499",62% off,4.1,"(96,714)",Electronics,Headphones,Boult
105,"HOPPUP AirDoze S40 Earbuds with 13MM Drivers, 40H Playt...",₹698,"₹3,999",82% off,4,"(44,163)",Electronics,Headphones,HOPPUP
106,"Number Super Buds 999 40dB ANC Gaming TWS Earbuds,4 Mic...","₹1,099","₹7,999",86% off,3.8,"(2,200)",Electronics,Headphones,Number
107,"truke Buds Vibe with 35dB ANC, 4Mic ENC, 13mm Speaker, ...","₹1,099","₹3,499",68% off,4,"(9,961)",Electronics,Headphones,truke
108,Aroma NB119 Titanium - 48 Hours Playtime Neckband Bluet...,₹450,"₹2,499",81% off,3.9,"(2,72,836)",Electronics,Headphones,Aroma
109,"boAt Airdopes 71 w/ 40 HRS Playback, ENx Technology & B...",₹999,"₹3,990",74% off,3.9,"(71,864)",Electronics,Headphones,boAt
110,"Voods V Collar - Pro With 5 Different Voice Modes,IP65 ...","₹1,349","₹5,549",75% off,,,Electronics,Headphones,Voods
111,TecSox Alpha Smart Wireless Earbuds| IPX| 40hrs Best Lo...,"₹1,399","₹5,999",76% off,5,(16),Electronics,Headphones,TecSox
112,"Boult Astra Neo 70Hrs Playtime, 4 Mic ENC, BT 5.4, 40ms...",₹999,"₹3,499",71% off,4.1,"(22,491)",Electronics,Headphones,Boult
113,"boAt Nirvana Ion 32dB Active Noise Cancellation, 120HRS...","₹1,899","₹9,990",80% off,4.1,"(89,576)",Electronics,Headphones,boAt
114,OnePlus E305A / E305B Bluetooth,"₹1,799","₹2,299",21% off,4.3,"(10,61,535)",Electronics,Headphones,OnePlus
115,boAt BassHeads 220 Super Extra Bass Wired,₹699,₹999,30% off,4.2,"(9,04,850)",Electronics,Headphones,boAt
116,"ERRAYNIX Atom Pro with 29 Hr Playtime,Quad Mic ENC,Deep...",₹696,"₹2,999",76% off,4.8,(5),Electronics,Headphones,ERRAYNIX
117,"Microflash Bluetooth Neckband Q32 50Hrs Battery, Deep B...",₹399,"₹1,999",80% off,3.6,(85),Electronics,Headphones,Microflash
118,"Noise Buds VS102 Plus with 70 Hrs Playtime, Environment...","₹1,199","₹3,999",70% off,3.9,"(94,095)",Electronics,Headphones,Noise
119,"boAt Rockerz 255 Z Plus w/ AI ENx Tech, Spatial Audio, ...","₹1,299","₹4,490",71% off,4.2,"(4,36,669)",Electronics,Headphones,boAt
120,"TMB Engage TWS Buds 25hrs Playtime, BT5.3, ENC Mic, Fas...",₹575,"₹1,999",71% off,3.3,(3),Electronics,Headphones,TMB
121,MadRabbit DYNO Jet Buds Bluetooth,"₹1,019","₹5,499",81% off,3.6,(23),Electronics,Headphones,MadRabbit
122,"truke BTG Flex buds with Dual Pairing, 60Hrs Battery, H...",₹999,"₹3,499",71% off,4.2,"(1,318)",Electronics,Headphones,truke
123,"boAt Rockerz 430 w/ Beast Mode(40ms Low Latency),40HRS ...","₹1,299","₹2,490",47% off,4.6,(101),Electronics,Headphones,boAt
124,OnePlus Nord Buds 3 with up to 32dB ANC Bluetooth,"₹2,299","₹2,799",17% off,4.3,"(2,756)",Electronics,Headphones,OnePlus
125,"realme Buds Air 6 Pro with 50dB ANC, 360 Spatial Audio ...","₹4,999","₹7,999",37% off,4.4,"(4,801)",Electronics,Headphones,realme
126,TIMBRESONIC Pod Lite Plus True Wireless Earbuds White B...,₹539,"₹2,799",80% off,3.7,(153),Electronics,Headphones,TIMBRESONIC
127,Blaupunkt BTW300 Xtreme True Wireless with Unstoppable ...,"₹1,599","₹5,999",73% off,4.2,(106),Electronics,Headphones,Blaupunkt
128,GUGGU NH-219 SH12 Headset Super Extra Bass Bluetooth He...,₹579,"₹1,149",49% off,4.2,(9),Electronics,Headphones,GUGGU
129,"Boult W10 55H Battery, 4 Mic ENC, Spatial Audio, 45ms L...",₹999,"₹2,499",60% off,4,"(5,026)",Electronics,Headphones,Boult
130,"Boston Levin Storm 9TWS,BT5.3,IPX5,ANC,32H of Playtime,...","₹1,399","₹8,999",84% off,3.6,(414),Electronics,Headphones,Boston
131,MEGABAR Saint 555 30HR IPX4 EMC Deep Bass HDMIC 10mm Dr...,₹407,"₹1,500",72% off,,,Electronics,Headphones,MEGABAR
132,"truke BTG Crystal Buds with Spatial Audio, Dual Pairing...",₹999,"₹3,499",71% off,4.9,(301),Electronics,Headphones,truke
133,"boAt Airdopes 71 w/ 40 HRS Playback, ENx Technology & B...",₹899,"₹3,990",77% off,3.9,"(71,864)",Electronics,Headphones,boAt
134,"Nilesawar X379 ARU-1128 ENC calling, 30 Hrs of Playtime...",₹389,"₹1,499",74% off,4.3,(16),Electronics,Headphones,Nilesawar
135,"Boult Z60 with 60Hr Battery, Quad Mic ENC, 50ms Ultra L...",₹999,"₹2,999",66% off,4.1,"(36,690)",Electronics,Headphones,Boult
136,AXL Ultron Earbuds Bluetooth,₹599,"₹1,499",60% off,4.3,(6),Electronics,Headphones,AXL
137,ajah Neckband Bluetooth Headset Fenton Bluetooth Headse...,₹399,₹899,55% off,,,Electronics,Headphones,ajah
138,"Boult Z40 with Zen ENC Mic, 60H Battery Life, Low Laten...",₹999,"₹4,999",80% off,4.1,"(3,10,952)",Electronics,Headphones,Boult
139,Clairbell NF-199 SH12 Headset Super Extra Bass Bluetoot...,₹579,"₹1,149",49% off,3.8,(13),Electronics,Headphones,Clairbell
140,uag urbn armour gear MUSIC & GAME series Bass sound Mat...,₹641,"₹2,499",74% off,3.7,(3),Electronics,Headphones,uag
141,"TMB D1 Mini TWS Buds 15hrs Playtime, BT5.2, Dual Mic, F...",₹569,"₹1,999",71% off,3.7,(3),Electronics,Headphones,TMB
142,"Boult Z40 Pro with 100H Battery, Quad Mic ENC, Scratch ...","₹1,299","₹5,499",76% off,4.1,"(95,464)",Electronics,Headphones,Boult
143,OnePlus Nord Buds 2r True Wireless in Ear Earbuds with ...,"₹1,999","₹2,299",13% off,4.3,"(1,47,619)",Electronics,Headphones,OnePlus
144,"Boult Y1 with Zen ENC Mic, 50H Battery, Fast Charging, ...",₹999,"₹5,499",81% off,4,"(4,28,027)",Electronics,Headphones,Boult
145,"Boult ProBass EQCharge with ZEN Mode ENC, 32hrs Playtim...",₹799,"₹4,499",82% off,3.9,"(1,32,496)",Electronics,Headphones,Boult
146,"Voods V Heads - Active IP65-Water&Dust Resistant, Noise...","₹1,709","₹5,549",69% off,4,(8),Electronics,Headphones,Voods
147,"Voods V Heads - Active IP65-Water&Dust Resistant, Noise...","₹1,709","₹5,549",69% off,3.9,(21),Electronics,Headphones,Voods
148,"Boult Astra with Quad Mic ENC, 48Hrs Battery, Low Laten...","₹1,299","₹3,499",62% off,4.1,"(96,714)",Electronics,Headphones,Boult
149,GUGGU FG-169 SH12 Headset Super Extra Bass Bluetooth He...,₹579,"₹1,149",49% off,2.5,(11),Electronics,Headphones,GUGGU
150,uag urbn armour gear UAG SONIC MUSIC SERIES HIGH Qualit...,₹596,"₹2,999",80% off,3.9,(8),Electronics,Headphones,uag
151,Baani Audio BN209-Grey in Ear 5.3 Bluetooth Neckband wi...,₹529,"₹2,499",78% off,4.4,(7),Electronics,Headphones,Baani
152,Aroma NB140 Ninja 40 Hours*Playtime | Deep Bass | Fast ...,₹449,"₹2,399",81% off,3.8,"(3,384)",Electronics,Headphones,Aroma
153,"realme Buds Air 6 with 50dB ANC, 12.4mm Bass Driver, Hi...","₹3,299","₹5,999",45% off,4.3,"(10,140)",Electronics,Headphones,realme
154,"Boult Astra with Quad Mic ENC, 48Hrs Battery, Low Laten...","₹1,299","₹3,499",62% off,4.1,"(96,714)",Electronics,Headphones,Boult
155,"TECHNUV S460 ANC High Quality Pure Sound, IPX5 Touch, M...",₹599,"₹2,499",76% off,4,(147),Electronics,Headphones,TECHNUV
156,MEGABAR Saint 333 30HR IPX4 With Deep Bass HDMIC 10mm D...,₹421,"₹1,999",78% off,3.1,(17),Electronics,Headphones,MEGABAR
157,uag urbn armour gear MAGNETIC SENSOR ON/OFF BULLET Z2 W...,₹604,"₹2,499",75% off,3.7,(3),Electronics,Headphones,uag
158,MZ Mpods19 (Wireless Earbuds) 1200mAh Battery True Wire...,₹399,"₹1,299",69% off,3.7,"(2,677)",Electronics,Headphones,MZ
159,"realme Buds Wireless 3 with 30dB ANC, 360 degree Spatia...","₹1,799","₹2,999",40% off,4.3,"(1,35,384)",Electronics,Headphones,realme
160,OPPO Enco Buds 2 with 28 hours Battery life & Deep Nois...,"₹1,599","₹3,999",60% off,4.3,"(3,84,039)",Electronics,Headphones,OPPO
161,"Boult Airbass Z35 with ZEN ENC Mic, 32H Playtime, 45ms ...",₹799,"₹2,999",73% off,3.9,"(1,25,841)",Electronics,Headphones,Boult
162,OnePlus Bullets Wireless Z2 ANC Earphones with 45dB Hyb...,"₹2,299","₹2,499",8% off,4.2,"(79,796)",Electronics,Headphones,OnePlus
163,OnePlus Nord Buds 3 Pro Truly Wireless Earbuds with 49d...,"₹3,299","₹3,699",10% off,4.4,"(9,938)",Electronics,Headphones,OnePlus
164,boAt Nirvana Ion with 120 Hours Playback & Crystal Bion...,"₹1,699","₹7,990",78% off,4.1,"(89,576)",Electronics,Headphones,boAt
165,OnePlus Nord Buds 3 Pro Truly Wireless Earbuds with 49d...,"₹3,299","₹3,699",10% off,4.4,"(9,938)",Electronics,Headphones,OnePlus
166,"Noise Buds VS102 with 50 Hrs Playtime, 11mm Driver, IPX...",₹999,"₹2,999",66% off,4,"(5,58,058)",Electronics,Headphones,Noise
167,"Boult Y1 with Zen ENC Mic, 50H Battery, Fast Charging, ...",₹999,"₹5,499",81% off,4,"(4,28,027)",Electronics,Headphones,Boult
168,"boAt Rockerz 210 ANC w/ 30dB Active Noise Cancellation,...","₹1,499","₹5,990",74% off,4.2,"(2,634)",Electronics,Headphones,boAt
169,"Aroma NB140 Power 50 Hours* Playtime, Dual Pairing True...",₹449,"₹1,999",77% off,3.5,"(8,903)",Electronics,Headphones,Aroma
170,"moto buds with Hi-Res Audio, Large 12.4mm driver, 42 hr...","₹1,999","₹7,999",75% off,4.1,"(4,098)",Electronics,Headphones,moto
171,"boAt Airdopes 161 Pro-Buds w/ ASAP Charge, Multi-Point ...","₹1,199","₹4,490",73% off,3.8,"(94,856)",Electronics,Headphones,boAt
172,"boAt Airdopes 181 Pro w/ 100 HRS Playback, 4 Mics ENx T...","₹1,199","₹4,990",75% off,4,"(22,057)",Electronics,Headphones,boAt
173,"boAt Airdopes 161 Pro-Buds w/ ASAP Charge, Multi-Point ...","₹1,199","₹4,490",73% off,3.8,"(94,856)",Electronics,Headphones,boAt
174,"Boult Z60 with 60Hr Battery, Quad Mic ENC, 50ms Ultra L...",₹999,"₹2,999",66% off,4.1,"(36,690)",Electronics,Headphones,Boult
175,"ZEBRONICS ZEB-BRO, With In-Line MiC, 3.5mm Jack, 10mm d...",₹159,₹399,60% off,3.7,"(90,010)",Electronics,Headphones,ZEBRONICS
176,"Boult Curve Max with 100H Playtime, ENC Mic, Dual Devic...",₹899,"₹5,499",83% off,3.8,"(2,590)",Electronics,Headphones,Boult
177,"TRIGGR Kraken X1 with Battery Display, 40ms Latency, Qu...",₹799,"₹3,999",80% off,4,"(48,663)",Electronics,Headphones,TRIGGR
178,"Boult Z40 Pro with 100H Battery, Quad Mic ENC, Scratch ...","₹1,199","₹5,499",78% off,4.1,"(95,464)",Electronics,Headphones,Boult
179,boAt Airdopes 131 with upto 60 hours and ASAP Charge Bl...,₹899,"₹2,990",69% off,4,"(18,96,429)",Electronics,Headphones,boAt
180,"moto buds with Hi-Res Audio, Large 12.4mm driver, 42 hr...","₹1,999","₹7,999",75% off,4.1,"(4,098)",Electronics,Headphones,moto
181,"realme Buds Air 5 with 50dB ANC, 12.4mm Dynamic Bass Dr...","₹2,799","₹5,999",53% off,4.3,"(33,795)",Electronics,Headphones,realme
182,Aroma NB119C Carter 48 Hours Playing Time Fast Charging...,₹301,"₹2,299",86% off,3.9,"(92,016)",Electronics,Headphones,Aroma
183,"Noise Buds VS102 Plus with 70 Hrs Playtime, Environment...","₹1,299","₹3,999",67% off,3.9,"(94,095)",Electronics,Headphones,Noise
184,"boAt Rockerz 430 w/ Beast Mode(40ms Low Latency),40HRS ...","₹1,299","₹2,490",47% off,4.6,(101),Electronics,Headphones,boAt
185,"Microflash Air Buds Pro E35 50Hrs Battery Life, High Ba...",₹599,"₹1,999",70% off,3.9,"(1,174)",Electronics,Headphones,Microflash
186,Logitech H-111 Wired,₹695,₹825,15% off,4,"(4,019)",Electronics,Headphones,Logitech
187,"boAt Airdopes 311 Pro w/ 50 HRS Playback, ASAP Charge &...","₹1,199","₹4,990",75% off,3.9,"(7,042)",Electronics,Headphones,boAt
188,"boAt Airdopes 161 Hulk Edition w/ 40 HRS Playback, ASAP...","₹1,099","₹2,490",55% off,4,"(11,46,438)",Electronics,Headphones,boAt
189,OnePlus Nord Buds 2 True Wireless Earbuds with 25dB Act...,"₹2,699","₹3,299",18% off,4.3,"(91,964)",Electronics,Headphones,OnePlus
190,"Boult YCharge with Pro+ Calling Mic, Full Charge in 20 ...",₹799,"₹1,999",60% off,3.9,"(72,681)",Electronics,Headphones,Boult
191,"Boult Z40 Gaming with 60H Battery, App Support, Dual Pa...",₹999,"₹5,499",81% off,4.1,"(3,10,952)",Electronics,Headphones,Boult
192,"TECHFIRE Bullets 360 TWS Earbuds with 100 HRS Playtime,...",₹649,"₹2,999",78% off,3.7,"(5,881)",Electronics,Headphones,TECHFIRE
193,"Boult Z40 with Zen ENC Mic, 60H Battery Life, Low Laten...",₹999,"₹4,999",80% off,4.1,"(3,10,952)",Electronics,Headphones,Boult
