,Product,Price,Original Price,Discount,Rating,Rating & reviews,Category,Sub category,brand
2989,"ain Radio AC/DC FM Speaker with Bluetooth, USB, SD Card...",₹798,"₹1,399",42% off,3.8,(569),Electronics,Home Entertainment,ain
2990,MEDHA D.J. PLUS Professional 160 Watt P.A. Amplifier Wi...,"₹5,999","₹13,900",56% off,3.7,(532),Electronics,Home Entertainment,MEDHA
2991,Techista 11001 FM BLUETOOTH USB AUX With Mic Slot 100 W...,"₹1,249","₹2,999",58% off,3.8,(396),Electronics,Home Entertainment,Techista
2992,MR ARTS Sheesham wood TV unit । tv cabinet for living r...,"₹18,000","₹24,000",25% off,,,Electronics,Home Entertainment,MR
2993,WOODSTAGE Solid Sheesham Wood Tv Unit Closed Storage So...,"₹16,992","₹25,999",34% off,,,Electronics,Home Entertainment,WOODSTAGE
2994,Green pearl Sheesham wood TV unit । tv cabinet for livi...,"₹13,999","₹28,999",51% off,,,Electronics,Home Entertainment,Green
2995,WOODSTAGE Solid Sheesham Wood Tv Unit ( Honey Finish) S...,"₹13,992","₹36,999",62% off,,,Electronics,Home Entertainment,WOODSTAGE
2996,Gca1woodzone Sheesham Wood T.V Unit |Wooden T.V Unit Fo...,"₹19,499","₹30,000",35% off,,,Electronics,Home Entertainment,Gca1woodzone
2997,KH HAYDEN HYA-4 Mixer Digital Sound Mixer,"₹3,799","₹5,999",36% off,,,Electronics,Home Entertainment,KH
2998,Adiohub Professional_Sound Stereo 2 Way / 3 Way/Mono Cr...,"₹6,945","₹8,499",18% off,3.8,(9),Electronics,Home Entertainment,Adiohub
2999,Urban Infotech Q12 2 Channel Sound Mixer Mini Mono Usb ...,"₹2,236","₹4,999",55% off,4,(4),Electronics,Home Entertainment,Urban
3000,Dotsun Ds-999 Bluetooth Full Black Digital Stereo Ampli...,"₹1,374","₹3,999",65% off,3.8,(244),Electronics,Home Entertainment,Dotsun
3001,MEDHA SEM-6 220 W AV Power Amplifier,"₹2,649","₹6,599",59% off,4.1,(121),Electronics,Home Entertainment,MEDHA
3002,TECH-LOBBY TL-2-64 70 W AV Power Amplifier,₹569,"₹1,499",62% off,3.6,(237),Electronics,Home Entertainment,TECH-LOBBY
3003,MEDHA Usb-90 110 W AV Control Receiver,"₹4,449","₹8,599",48% off,4,(533),Electronics,Home Entertainment,MEDHA
3004,MEDHA SM-6 220 W AV Control Receiver,"₹1,860","₹5,299",64% off,3.9,(166),Electronics,Home Entertainment,MEDHA
3005,WOODSTAGE Solid Sheesham Wood Tv Unit ( Walnut Finish) ...,"₹13,992","₹32,599",57% off,,,Electronics,Home Entertainment,WOODSTAGE
3006,KDINTERIORS Gold and Gray Modern TV Stand for TV's Up t...,"₹82,389","₹1,49,999",45% off,,,Electronics,Home Entertainment,KDINTERIORS
3007,Green pearl Sheesham wood TV unit । tv cabinet for livi...,"₹16,999","₹28,999",41% off,,,Electronics,Home Entertainment,Green
3008,Home wood Wooden TV Entertainment unit Standard size En...,"₹1,499","₹3,499",57% off,,,Electronics,Home Entertainment,Home
3009,Furnifry TV Entertainment Unit with Storage/TV Cabinet ...,"₹5,899","₹9,999",41% off,,,Electronics,Home Entertainment,Furnifry
3010,Mocking Bird Q12 2 Channel Audio Mixer with 48V Phantom...,"₹2,134","₹8,999",76% off,,,Electronics,Home Entertainment,Mocking
3011,"IMAGINEA Sound Mixer 2 Channels DJ Audio Interface, 48V...","₹2,349","₹3,999",41% off,,,Electronics,Home Entertainment,IMAGINEA
3012,AMG Music 2Channel Mini Sound Mixer Audio DJ Mixer Cons...,"₹2,481","₹5,499",54% off,,,Electronics,Home Entertainment,AMG
3013,IMAGINEA mini 2 channel audio DJ mixer console interfac...,"₹2,170","₹3,999",45% off,1.6,(5),Electronics,Home Entertainment,IMAGINEA
3014,LipiWorld Home Theatre System Remote Control Compatible...,₹299,₹499,40% off,5,(3),Electronics,Home Entertainment,LipiWorld
3015,MEDHA PROFESSIONAL 100 WATT P.A. AMP WITH MOSFET TECHNO...,"₹4,008","₹14,900",73% off,4.3,(3),Electronics,Home Entertainment,MEDHA
3016,"Verilux Disk,with Shoulder Belt, Portable Voice Amplifi...","₹1,295","₹2,404",46% off,4.2,(63),Electronics,Home Entertainment,Verilux
3017,FINE 007 HERO IPL AMPLIFIER Multimedia Player with Blue...,₹699,"₹2,499",72% off,3.6,(65),Electronics,Home Entertainment,FINE
3018,ABODOS M.NO.-995 High Quality 8Transistor 4Channel Ster...,"₹2,399","₹9,599",75% off,3.5,(644),Electronics,Home Entertainment,ABODOS
3019,MEDHA D.J. PLUS MD-1600REC 160 W AV Power Amplifier,"₹4,969","₹9,756",49% off,4,(4),Electronics,Home Entertainment,MEDHA
3020,Home wood Wooden TV Entertainment unit Standard size En...,"₹1,499","₹2,999",50% off,,,Electronics,Home Entertainment,Home
3021,Hisense Metal TV Entertainment Unit,"₹11,300","₹16,597",31% off,,,Electronics,Home Entertainment,Hisense
3022,Green pearl Sheesham wood TV unit । tv cabinet for livi...,"₹14,579","₹28,999",49% off,,,Electronics,Home Entertainment,Green
3023,Home wood Latest Wooden TV Entertainment unit Standard ...,"₹2,099","₹3,499",40% off,,,Electronics,Home Entertainment,Home
3024,WOODSTAGE Solid Sheesham Wood Tv Unit 4 Drawer Closed S...,"₹18,992","₹25,999",26% off,,,Electronics,Home Entertainment,WOODSTAGE
3025,Mocking Bird Q12 2Channel Audio Mixer USB Sound Card Au...,"₹2,076","₹4,299",51% off,3.8,(12),Electronics,Home Entertainment,Mocking
3026,IMAGINEA Q12 2 Channel Audio Mixer Mini Mono USB Audio ...,"₹2,133","₹3,999",46% off,,,Electronics,Home Entertainment,IMAGINEA
3027,Urban Infotech Q12 Mixer With XLR Powered Sound Mixer,"₹1,999","₹3,999",50% off,,,Electronics,Home Entertainment,Urban
3028,Urban Infotech Phantom Power for Condenser Microphone A...,"₹1,231","₹2,999",58% off,,,Electronics,Home Entertainment,Urban
3029,BhalTech Home Theater 2.1 Channel Soundbar Aavante Bar ...,₹289,₹499,42% off,,,Electronics,Home Entertainment,BhalTech
3030,MEDHA D.J. PLUS MDA-450BT 220 W AV Power Amplifier,"₹2,019","₹3,999",49% off,3.5,(106),Electronics,Home Entertainment,MEDHA
3031,"FINE IPL AMPLIFIER Multimedia Player with Bluetooth,USB...",₹709,"₹1,999",64% off,3.8,(89),Electronics,Home Entertainment,FINE
3032,Cubetek LCD Display V5.0 Bluetooth Transmitter Receiver...,"₹1,889","₹3,100",39% off,3.9,(144),Electronics,Home Entertainment,Cubetek
3033,"MEDHA D.J. PLUS Professional Recording Usb-900U ,90 Wat...","₹4,209","₹9,599",56% off,4,(33),Electronics,Home Entertainment,MEDHA
3034,solomax New Series 1002 IRON FIST 4440 DOUBLE IC Blueto...,₹999,"₹2,999",66% off,3.8,"(1,073)",Electronics,Home Entertainment,solomax
3035,Green pearl Sheesham wood TV unit । tv cabinet for livi...,"₹13,579","₹28,999",53% off,,,Electronics,Home Entertainment,Green
3036,Shalom Interio Home Full Engineered Wood TV Entertainme...,"₹15,999","₹16,999",5% off,,,Electronics,Home Entertainment,Shalom
3037,Home wood Wooden TV Entertainment unit Standard size En...,"₹1,499","₹3,299",54% off,,,Electronics,Home Entertainment,Home
3038,UniAart Engineered Wood TV Entertainment Unit,"₹1,573","₹2,999",47% off,,,Electronics,Home Entertainment,UniAart
3039,UniAart Engineered Wood TV Entertainment Unit,"₹1,573","₹2,999",47% off,,,Electronics,Home Entertainment,UniAart
3040,FREDI HD PLUS Spy Voice Audio Recorder Super Long Stora...,"₹1,200","₹2,999",59% off,3,(5),Electronics,Home Entertainment,FREDI
3041,MEDHA D.J. PLUS 6 Channel Professional Audio Mixer For ...,"₹2,399","₹6,999",65% off,,,Electronics,Home Entertainment,MEDHA
3042,DawnRays Mini Audio Mixer V8 2 Channel With 48V Phantom...,"₹2,190","₹3,999",45% off,,,Electronics,Home Entertainment,DawnRays
3043,keertan kalp PWM DC 24-12- 6v-28VDC 3A 80w PWM Control ...,₹299,₹449,33% off,,,Electronics,Home Entertainment,keertan
3044,Adiohub Audio Mixer 4 Channel Mini Audio Mixer DJ contr...,"₹3,333","₹5,999",44% off,3.7,(12),Electronics,Home Entertainment,Adiohub
3045,HDF Replacement Remote Control for Philips 4040F Home T...,"₹1,499","₹1,999",25% off,,,Electronics,Home Entertainment,HDF
3046,MEDHA Professional 8 Channel Stero Echo Mixer With Top ...,"₹3,049","₹7,999",61% off,4,(275),Electronics,Home Entertainment,MEDHA
3047,MEDHA D.J. PLUS MD-USB-60 60 W AV Power Amplifier,"₹2,489","₹4,999",50% off,3.6,(38),Electronics,Home Entertainment,MEDHA
3048,MEDHA D.J. PLUS Professional 100 Watt P.A. Amplifier Wi...,"₹4,081","₹9,790",58% off,3.9,(67),Electronics,Home Entertainment,MEDHA
3049,Ahuja DPA 770M with Bluetooth & USB option 75 W AV Powe...,"₹10,849","₹11,390",4% off,4.3,(331),Electronics,Home Entertainment,Ahuja
3050,Ahuja Amplifier SSB-60 EM 160 W AV Power Receiver,"₹8,350","₹8,999",7% off,3.8,(77),Electronics,Home Entertainment,Ahuja
3051,Umar Enterprises Wall T.V entertainment unit set up box...,₹799,"₹1,099",27% off,,,Electronics,Home Entertainment,Umar
3052,RESHUZ Wall TV Set up Box TV Entertainment Unit MDF Wal...,₹499,₹999,50% off,,,Electronics,Home Entertainment,RESHUZ
3053,RESHUZ Wall TV Set up Box TV Entertainment Unit MDF Wal...,₹849,"₹1,599",46% off,,,Electronics,Home Entertainment,RESHUZ
3054,RESHUZ Wall TV Set up Box TV Entertainment Unit MDF Wal...,₹859,"₹1,599",46% off,,,Electronics,Home Entertainment,RESHUZ
3055,RESHUZ Wall TV Set up Box TV Entertainment Unit MDF Wal...,₹849,"₹1,599",46% off,,,Electronics,Home Entertainment,RESHUZ
3056,Adiohub Professional_Live Sound Card Mixer LED Voice Ch...,"₹1,998","₹2,999",33% off,3.4,(36),Electronics,Home Entertainment,Adiohub
3057,Mocking Bird Audio Mixer- 2 Channels USB Audio Interfac...,"₹2,194","₹4,299",48% off,,,Electronics,Home Entertainment,Mocking
3058,KH HAYDEN Professional Audio Mixer Digital Sound Mixer,"₹3,499","₹4,999",30% off,,,Electronics,Home Entertainment,KH
3059,Mocking Bird Professional Audio Mixer- 2 Channel Mixer ...,"₹2,194","₹5,999",63% off,,,Electronics,Home Entertainment,Mocking
3060,BhalTech DSP2800 PU Leather Remote Case Cover Perfect F...,₹219,₹499,56% off,2.9,(14),Electronics,Home Entertainment,BhalTech
3061,HSNAKE MINI CAR STERIO USB PLAYER SINGLE 6283 IC 100 W ...,₹498,₹999,50% off,3.5,(24),Electronics,Home Entertainment,HSNAKE
3062,MEDHA MD-1200UBT 120 W AV Power Amplifier,"₹4,849","₹10,900",55% off,3.9,(387),Electronics,Home Entertainment,MEDHA
3063,FreshDcart Wireless Voice Amplifier 8 W AV Control Ampl...,₹849,"₹4,999",83% off,3.6,(9),Electronics,Home Entertainment,FreshDcart
3064,"Verilux Voice Amplifier Microphone Headset Set,2200 mAh...","₹1,299","₹3,023",57% off,3.8,(61),Electronics,Home Entertainment,Verilux
3065,KAXTANG HI cluffel 003 audio player Digital Stereo Ampl...,"₹1,199","₹3,599",66% off,,,Electronics,Home Entertainment,KAXTANG
3066,Umar Enterprises Wall T.V set up box stand & Wifi stand...,₹839,"₹1,450",42% off,2.5,(10),Electronics,Home Entertainment,Umar
3067,RESHUZ Wall TV Set up Box TV Entertainment Unit MDF Wal...,₹799,"₹1,999",60% off,,,Electronics,Home Entertainment,RESHUZ
3068,Umar Enterprises Wall T.V set up box stand & Wifi stand...,₹892,"₹1,099",18% off,2.5,(10),Electronics,Home Entertainment,Umar
3069,home design mart Engineered Wood TV Entertainment Unit,"₹1,279","₹3,599",64% off,3.8,(11),Electronics,Home Entertainment,home
3070,FORKTAIL Floor Standing TV Entertainment Unit Set Top B...,"₹12,499","₹18,990",34% off,,,Electronics,Home Entertainment,FORKTAIL
3071,KH 8 Channel Mini Portable Audio Sound Mixer DJ (Mono 8...,"₹2,149","₹3,999",46% off,1.7,(3),Electronics,Home Entertainment,KH
3072,IMAGINEA V8 Pro Audio Mixer |Live Sound Card | Audio In...,"₹1,599","₹3,999",60% off,,,Electronics,Home Entertainment,IMAGINEA
3073,AMG Music V8s Audio Mixer | Live Sound Card | Audio Int...,"₹1,999","₹2,999",33% off,,,Electronics,Home Entertainment,AMG
3074,"Urban Infotech Professional Audio Mixer, V8S Live Sound...","₹1,599","₹3,199",50% off,,,Electronics,Home Entertainment,Urban
3075,SHIELDGUARD Remote Control F6000U Compatible for Home T...,₹289,₹599,51% off,4.3,(32),Electronics,Home Entertainment,SHIELDGUARD
3076,MEDHA D.J. PLUS 90 WATT PA AMPLIFIER WITH MOSFET TECHNO...,"₹3,846","₹10,900",64% off,4.3,(4),Electronics,Home Entertainment,MEDHA
3077,Target TT-805 120 W AV Power Amplifier,"₹2,799","₹4,299",34% off,3.9,(77),Electronics,Home Entertainment,Target
3078,BALRAMA Bluetooth MP3 Decoding Board Module SD Card Slo...,₹399,"₹1,000",60% off,,,Electronics,Home Entertainment,BALRAMA
3079,ain 2 Channel High Power Stereo Amplifier with Big LED ...,"₹1,269","₹1,599",20% off,3.7,(80),Electronics,Home Entertainment,ain
3080,FREDI HD PLUS Spy HD Micro Digital Voice Recorder Devic...,"₹1,174","₹3,999",70% off,3.4,(12),Electronics,Home Entertainment,FREDI
3081,Home Full Engineered Wood TV Entertainment Unit,"₹8,690","₹13,399",35% off,4.1,"(3,424)",Electronics,Home Entertainment,Home
3082,@Home by nilkamal Aroy Engineered Wood TV Entertainment...,"₹10,999","₹18,900",41% off,4.2,(929),Electronics,Home Entertainment,@Home
3083,"Home wood Latest Wooden wall setup box stand, Brown Eng...","₹1,280","₹2,499",48% off,4.2,"(1,090)",Electronics,Home Entertainment,Home
3084,Home Full Engineered Wood TV Entertainment Unit,"₹3,954","₹8,000",50% off,4.3,"(1,482)",Electronics,Home Entertainment,Home
3085,Home wood Engineered Wood TV Entertainment Unit,"₹1,316","₹1,999",34% off,4,(356),Electronics,Home Entertainment,Home
3086,Urban Infotech Audio with Mixer Live Sound Card Effects...,"₹1,999","₹3,999",50% off,,,Electronics,Home Entertainment,Urban
3087,"IMAGINEA Audio Mixer,Audio Interface DJ Mixer Live Soun...","₹1,999","₹4,999",60% off,,,Electronics,Home Entertainment,IMAGINEA
3088,Da.Beatz. 8 channel SM800E Audio mixer Analog Sound Mix...,"₹5,999","₹9,999",40% off,,,Electronics,Home Entertainment,Da.Beatz.
3089,amiciSound 4-Channel USB Bluetooth Audio Mixing Console...,"₹11,999","₹13,000",7% off,,,Electronics,Home Entertainment,amiciSound
3090,GREEN SOUL Vision Multi-Functional Ergonomic Chair|Gami...,"₹19,999","₹42,990",53% off,4.5,(125),Electronics,Home Entertainment,GREEN
3091,Ahuja Amplifier SSB-45EM 45 W AV Power Amplifier,"₹6,300","₹6,600",4% off,4.2,(69),Electronics,Home Entertainment,Ahuja
3092,Ahuja DPA 570M with Bluetooth&USB 50 W AV Power Amplifi...,"₹8,549","₹9,770",12% off,4,(135),Electronics,Home Entertainment,Ahuja
3093,Verilux Voice-Amplifier Microphone Headset Set - PA Sys...,"₹1,299","₹1,920",32% off,4.2,(68),Electronics,Home Entertainment,Verilux
3094,Palco plc3333 Double Speaker 25 W AV Power Amplifier,"₹2,299","₹3,000",23% off,3.8,(373),Electronics,Home Entertainment,Palco
3095,MEDHA Amplifier 110 W AV Power Amplifier,"₹4,549","₹8,599",47% off,3.9,(441),Electronics,Home Entertainment,MEDHA
3096,Home wood TV and entertainment unit perfect for 32 inch...,"₹1,479","₹3,299",55% off,4.3,(51),Electronics,Home Entertainment,Home
3097,@Home by nilkamal Jonas Engineered Wood TV Entertainmen...,"₹12,499","₹22,900",45% off,4.2,(109),Electronics,Home Entertainment,@Home
3098,Home wood TV cabinet and entertainment unit perfect for...,"₹1,449","₹2,499",42% off,,,Electronics,Home Entertainment,Home
3099,Home wood Engineered Wood TV Entertainment Unit,"₹1,309","₹2,599",49% off,3.6,(52),Electronics,Home Entertainment,Home
3100,Home wood Engineered Wood Wall Mount TV Entertainment U...,"₹1,479","₹3,299",55% off,4.3,(51),Electronics,Home Entertainment,Home
3101,Mocking Bird Audio Mixer |Live Sound Card |Audio Interf...,"₹1,999","₹3,599",44% off,,,Electronics,Home Entertainment,Mocking
3102,sriaarnika 6 Channel Professional Digital Echo Sound Mi...,"₹2,748","₹4,500",38% off,,,Electronics,Home Entertainment,sriaarnika
3103,DawnRays Q12 2 Channel Audio Mixer Mini Usb Audio Inter...,"₹2,285","₹3,599",36% off,,,Electronics,Home Entertainment,DawnRays
3104,microware MMPL-DG2ANLOG Analog Sound Mixer,"₹1,799","₹2,499",28% off,,,Electronics,Home Entertainment,microware
3105,selloria RM-ANU156 Compatible For Home Theater System R...,₹328,₹999,67% off,4.3,(39),Electronics,Home Entertainment,selloria
3106,stranger C15 Guitar/Keyboard/Mic 15 W AV Power Amplifie...,"₹5,849","₹6,500",10% off,4.2,(91),Electronics,Home Entertainment,stranger
3107,Target TT529 80 W AV Power Amplifier,"₹2,299","₹2,999",23% off,3.9,(645),Electronics,Home Entertainment,Target
3108,MEDHA D.J. PLUS MD-60BT 60 W AV Power Amplifier,"₹2,922","₹4,999",41% off,3.8,(211),Electronics,Home Entertainment,MEDHA
3109,TECH-LOBBY TL-MAGIC 6 W AV Control Receiver,₹599,₹999,40% off,3.5,(403),Electronics,Home Entertainment,TECH-LOBBY
3110,etmax INOXE series 4.1 Home Cinema,"₹2,389","₹4,100",41% off,3.8,"(1,160)",Electronics,Home Entertainment,etmax
3111,Home Full Engineered Wood TV Entertainment Unit,"₹5,772","₹17,000",66% off,4.1,(15),Electronics,Home Entertainment,Home
3112,Home wood Wooden wall mount tv unit perfect for 32 inch...,"₹1,198","₹2,499",52% off,4.1,(141),Electronics,Home Entertainment,Home
3113,Home Full Engineered Wood TV Entertainment Unit,"₹5,590","₹17,000",67% off,,,Electronics,Home Entertainment,Home
3114,Home Full Engineered Wood TV Entertainment Unit,"₹6,902","₹13,000",46% off,4.2,"(3,561)",Electronics,Home Entertainment,Home
3115,"Home wood Latest Wooden wall setup box stand, Brown Eng...","₹1,249","₹2,499",50% off,4.1,(118),Electronics,Home Entertainment,Home
3116,DHRUV-PRO 10Pcs/Lot Double B10K B10KX2 Pot Mixer Fader ...,"₹1,324","₹1,999",33% off,,,Electronics,Home Entertainment,DHRUV-PRO
3117,keertan kalp PWM DC 24-12-6v-28VDC 3A 80w Motor Speed C...,₹412,₹799,48% off,,,Electronics,Home Entertainment,keertan
3118,umi BE-1412 Hexagon polyester fiber panel 14x12x0.4in 6...,"₹2,599","₹3,599",27% off,,,Electronics,Home Entertainment,umi
3119,umi BE-1412 Hexagon polyester fiber panel 14x12x0.4in 1...,"₹5,099","₹6,599",22% off,,,Electronics,Home Entertainment,umi
3120,Prix Digital Multimedia Player Music Amplifier Receiver...,₹762,"₹1,299",41% off,3.6,(61),Electronics,Home Entertainment,Prix
3121,KAXTANG BLUE LED LIGHT AMPLIFIER NEW SERIES SOLOMAX ABS...,"₹1,249","₹2,999",58% off,3.9,(267),Electronics,Home Entertainment,KAXTANG
3122,Etzin Bluetooth 5.0 Transmitter Receiver 2-in-1 Wireles...,₹882,"₹1,999",55% off,3.9,(32),Electronics,Home Entertainment,Etzin
3123,Kizma AV to HDMI Video Audio Adapter VHS VCR Camera DVD...,₹499,₹799,37% off,3.8,(17),Electronics,Home Entertainment,Kizma
3124,Ahuja SSB-M 80 WATTS 80 W AV Power Amplifier,"₹9,149","₹9,400",2% off,4.1,(84),Electronics,Home Entertainment,Ahuja
3125,"Home wood Latest Wooden wall setup box stand, Brown Eng...","₹1,199","₹2,499",52% off,3.9,(175),Electronics,Home Entertainment,Home
3126,home design mart TV55677766544 Engineered Wood TV Enter...,"₹1,314","₹3,400",61% off,3.5,(45),Electronics,Home Entertainment,home
3127,Home wood latest wooden wall setup box stand Engineered...,₹979,"₹1,999",51% off,3.7,(38),Electronics,Home Entertainment,Home
3128,Home Full Engineered Wood TV Entertainment Unit,"₹8,390","₹13,000",35% off,4.2,"(3,561)",Electronics,Home Entertainment,Home
3129,Home wood Engineered Wood TV Entertainment Unit,"₹1,899","₹3,199",40% off,4.3,(51),Electronics,Home Entertainment,Home
3130,umi BE-1212 square polyester fiber panel 12x12x0.4in 6N...,"₹2,099","₹3,099",32% off,,,Electronics,Home Entertainment,umi
3131,umi BE-1212 square polyester fiber panel 12x12x0.4in 12...,"₹4,099","₹5,599",26% off,,,Electronics,Home Entertainment,umi
3132,umi BE-1212 square polyester fiber panel 12x12x0.4in 12...,"₹4,099","₹5,599",26% off,,,Electronics,Home Entertainment,umi
3133,umi BE-1412 Hexagon polyester fiber panel 14x12x0.4in 6...,"₹2,599","₹3,599",27% off,,,Electronics,Home Entertainment,umi
3134,Cezo Home Theater Remote Control Compatible for Home Th...,₹210,₹999,78% off,4,(150),Electronics,Home Entertainment,Cezo
3135,Grenaro MI6662 Wireless Voice Amplifier for Teachers wi...,"₹2,999","₹5,999",50% off,,,Electronics,Home Entertainment,Grenaro
3136,TECH-LOBBY TL-26 0.5 W AV Control Amplifier,₹679,"₹1,499",54% off,3.4,(36),Electronics,Home Entertainment,TECH-LOBBY
3137,Vora 4440 Karaoke Bluetoot Double MIC |FM/USB/AUX/MP3/S...,"₹1,149","₹3,990",71% off,,,Electronics,Home Entertainment,Vora
3138,TECH-LOBBY TL-SH014 70 W AV Power Amplifier,"₹1,599","₹1,999",20% off,3.6,(15),Electronics,Home Entertainment,TECH-LOBBY
3139,Ahuja HBM-50 Wired Over Headphone With 1m wire Micropho...,₹752,₹865,13% off,3.9,(26),Electronics,Home Entertainment,Ahuja
3140,Home Full Engineered Wood TV Entertainment Unit,"₹3,490","₹10,000",65% off,4.1,(853),Electronics,Home Entertainment,Home
3141,Home Full Engineered Wood TV Entertainment Unit,"₹5,752","₹14,000",58% off,4.2,(990),Electronics,Home Entertainment,Home
3142,"Home wood Latest Wooden wall setup box stand, Brown Eng...","₹1,199","₹2,499",52% off,3.8,(25),Electronics,Home Entertainment,Home
3143,Home Full Prince Engineered Wood TV Entertainment Unit,"₹6,987","₹11,399",38% off,4.1,(774),Electronics,Home Entertainment,Home
3144,"Home wood Latest Wooden wall setup box stand, Brown Eng...","₹1,499","₹3,499",57% off,3.8,(37),Electronics,Home Entertainment,Home
3145,umi BE-1612 square polyester fiber panel 16x12x0.4in 6N...,"₹2,899","₹3,899",25% off,,,Electronics,Home Entertainment,umi
3146,umi BE-1212 square polyester fiber panel 12x12x0.4in 6N...,"₹2,099","₹3,099",32% off,,,Electronics,Home Entertainment,umi
3147,umi BE-1212 square polyester fiber panel 12x12x0.4in 12...,"₹4,099","₹5,599",26% off,,,Electronics,Home Entertainment,umi
3148,umi BE-1412 Hexagon polyester fiber panel 14x12x0.4in 1...,"₹5,099","₹6,599",22% off,,,Electronics,Home Entertainment,umi
3149,SHIELDGUARD Remote Control Compatible for Home Theater...,₹258,₹499,48% off,4.2,(10),Electronics,Home Entertainment,SHIELDGUARD
3150,Palco plc104 Bass 25 W AV Power Amplifier,"₹2,299","₹3,000",23% off,3.8,(293),Electronics,Home Entertainment,Palco
3151,Da.Beatz. DB - 45U Amplifier Bluetooth/MIC/USB/SD Card ...,"₹2,249","₹4,999",55% off,,,Electronics,Home Entertainment,Da.Beatz.
3152,TECH-LOBBY TL-779 0.5 W AV Control Amplifier,₹699,₹999,30% off,3.4,(110),Electronics,Home Entertainment,TECH-LOBBY
3153,TECH-LOBBY TL-9802 80 W AV Power Amplifier,"₹3,099","₹3,899",20% off,3.8,(46),Electronics,Home Entertainment,TECH-LOBBY
3154,MEDHA D.J. PLUS MD-1200UREC 120 W AV Power Amplifier,"₹4,249","₹6,999",39% off,3.7,(38),Electronics,Home Entertainment,MEDHA
3155,Home wood latest wooden wall setup box stand Engineered...,"₹1,499","₹3,500",57% off,4.2,(6),Electronics,Home Entertainment,Home
3156,Home Full Engineered Wood TV Entertainment Unit,"₹6,688","₹10,999",39% off,4.2,(893),Electronics,Home Entertainment,Home
3157,Home Full Engineered Wood TV Entertainment Unit,"₹2,966","₹8,000",62% off,4.4,(27),Electronics,Home Entertainment,Home
3158,Home Full Engineered Wood TV Entertainment Unit,"₹3,105","₹8,000",61% off,4.4,(25),Electronics,Home Entertainment,Home
3159,Home wood Wooden tv entertainment unit Engineered Wood ...,"₹1,249","₹2,499",50% off,3.9,(147),Electronics,Home Entertainment,Home
3160,"FREDI HD PLUS Spy Digital Voice Recorder, Small Sized A...","₹1,200","₹2,999",59% off,4.8,(4),Electronics,Home Entertainment,FREDI
3161,umi BE-1412 Hexagon polyester fiber panel 14x12x0.4in 1...,"₹5,099","₹6,599",22% off,,,Electronics,Home Entertainment,umi
3162,umi BE-1212 square polyester fiber panel 12x12x0.4in 12...,"₹4,099","₹5,599",26% off,,,Electronics,Home Entertainment,umi
3163,umi BE-1212 square polyester fiber panel 12x12x0.4in 12...,"₹4,099","₹5,599",26% off,,,Electronics,Home Entertainment,umi
3164,umi BE-1412 Hexagon polyester fiber panel 14x12x0.4in 6...,"₹2,599","₹3,599",27% off,,,Electronics,Home Entertainment,umi
3165,SHIELDGUARD Remote Control 612 Compatible for Onix Home...,₹299,₹499,40% off,,,Electronics,Home Entertainment,SHIELDGUARD
3166,M MOD CON 999 Bluetooth AUX USB 158 W AV Control Amplif...,"₹1,287","₹2,999",57% off,3.9,(183),Electronics,Home Entertainment,M
3167,EKAAZ 1/4 Inch Mono Wire Connector Male Jack Adapter fo...,₹246,₹699,64% off,,,Electronics,Home Entertainment,EKAAZ
3168,MEDHA D.P.-1200U 120 W AV Power Amplifier,"₹4,248","₹10,540",59% off,3.9,(144),Electronics,Home Entertainment,MEDHA
3169,Dotsun Ds-3011 Bluetooth Full Black Digital Stereo Ampl...,"₹2,399","₹7,999",70% off,3.8,(48),Electronics,Home Entertainment,Dotsun
3170,TOPLUS DASH 8002 AMF Bluetooth USB AUX FM With Mic Slot...,"₹1,349","₹3,999",66% off,,,Electronics,Home Entertainment,TOPLUS
3171,Spyder Home Decore Matte Finish D4 TV Unit with Wall Sh...,"₹7,499","₹23,999",68% off,2,(9),Electronics,Home Entertainment,Spyder
3172,Home wood Engineered Wood TV Entertainment Unit,₹899,"₹1,699",47% off,3.9,(9),Electronics,Home Entertainment,Home
3173,Vintage Home Urban Glow Entertainment Stand Jodhpur Fur...,"₹10,292","₹29,999",65% off,,,Electronics,Home Entertainment,Vintage
3174,Home wood Engineered Wood TV Entertainment Unit,₹949,"₹1,999",52% off,3.5,(14),Electronics,Home Entertainment,Home
3175,home design mart CAB898885444 Engineered Wood TV Entert...,"₹3,009","₹10,999",72% off,,,Electronics,Home Entertainment,home
3176,umi BE-1212 square polyester fiber panel 12x12x0.4in 6N...,"₹2,099","₹3,099",32% off,,,Electronics,Home Entertainment,umi
3177,umi BE-1212 square polyester fiber panel 12x12x0.4in 6N...,"₹2,099","₹3,099",32% off,,,Electronics,Home Entertainment,umi
3178,umi BE-1212 square polyester fiber panel 12x12x0.4in 6N...,"₹2,099","₹3,099",32% off,,,Electronics,Home Entertainment,umi
3179,umi BE-1612 square polyester fiber panel 16x12x0.4in 6N...,"₹2,899","₹3,899",25% off,,,Electronics,Home Entertainment,umi
3180,Akshita F380X 5.1 HT Compatible For Home Theater System...,₹379,"₹1,000",62% off,3.1,(18),Electronics,Home Entertainment,Akshita
